{
  "description": "Generated dungeon monster rarity tuning, challenge scaling, and loot-depth offsets for v30.",
  "monster_def_id": "dungeon_mob",
  "rarities": [
    {
      "id": "common",
      "weight": 100,
      "color": "#f2f2ec",
      "hp_multiplier": 1,
      "damage_multiplier": 1,
      "xp_multiplier": 1,
      "armor_multiplier": 1,
      "armor_bonus": 0,
      "hit_chance_bonus": 0,
      "crit_chance_bonus": 0,
      "block_percent_bonus": 0,
      "attack_cooldown_multiplier": 1,
      "loot_depth_offset": 0,
      "visual_scale": 1.0,
      "expected": {
        "max_hp": 4,
        "attack_damage": {
          "min": 1,
          "max": 2
        },
        "armor": 0,
        "hit_chance": 0.5,
        "crit_chance": 0,
        "block_percent": 0,
        "attack_cooldown_ticks": 21,
        "xp_reward": 5
      }
    },
    {
      "id": "champion",
      "weight": 15,
      "color": "#9fc7ff",
      "hp_multiplier": 1.5,
      "damage_multiplier": 1.25,
      "xp_multiplier": 1.5,
      "armor_multiplier": 1.15,
      "armor_bonus": 1,
      "hit_chance_bonus": 0.04,
      "crit_chance_bonus": 0.02,
      "block_percent_bonus": 4,
      "attack_cooldown_multiplier": 0.9,
      "loot_depth_offset": 1,
      "visual_scale": 1.25,
      "expected": {
        "max_hp": 7,
        "attack_damage": {
          "min": 1,
          "max": 3
        },
        "armor": 2,
        "hit_chance": 0.56,
        "crit_chance": 0.025,
        "block_percent": 5,
        "attack_cooldown_ticks": 18,
        "xp_reward": 8
      }
    },
    {
      "id": "rare",
      "weight": 6,
      "color": "#ff9b9b",
      "hp_multiplier": 2,
      "damage_multiplier": 1.5,
      "xp_multiplier": 2,
      "armor_multiplier": 1.35,
      "armor_bonus": 2,
      "hit_chance_bonus": 0.08,
      "crit_chance_bonus": 0.05,
      "block_percent_bonus": 8,
      "attack_cooldown_multiplier": 0.82,
      "loot_depth_offset": 2,
      "visual_scale": 1.0,
      "expected": {
        "max_hp": 11,
        "attack_damage": {
          "min": 2,
          "max": 4
        },
        "armor": 3,
        "hit_chance": 0.62,
        "crit_chance": 0.06,
        "block_percent": 10,
        "attack_cooldown_ticks": 16,
        "xp_reward": 10
      }
    },
    {
      "id": "unique",
      "weight": 3,
      "color": "#ffd978",
      "hp_multiplier": 3,
      "damage_multiplier": 2,
      "xp_multiplier": 3,
      "armor_multiplier": 1.75,
      "armor_bonus": 4,
      "hit_chance_bonus": 0.12,
      "crit_chance_bonus": 0.08,
      "block_percent_bonus": 12,
      "attack_cooldown_multiplier": 0.75,
      "loot_depth_offset": 3,
      "visual_scale": 1.5,
      "expected": {
        "max_hp": 18,
        "attack_damage": {
          "min": 3,
          "max": 5
        },
        "armor": 7,
        "hit_chance": 0.68,
        "crit_chance": 0.095,
        "block_percent": 15,
        "attack_cooldown_ticks": 14,
        "xp_reward": 15
      }
    }
  ],
  "effective_depth_cases": [
    {
      "level": -1,
      "rarity": "common",
      "expected_effective_depth": 1,
      "expected_monster_loot_table": "dungeon_mob_drop_depth_1"
    },
    {
      "level": -1,
      "rarity": "champion",
      "expected_effective_depth": 2,
      "expected_monster_loot_table": "dungeon_mob_drop_depth_2"
    },
    {
      "level": -2,
      "rarity": "rare",
      "expected_effective_depth": 4,
      "expected_monster_loot_table": "dungeon_mob_drop_depth_3_plus"
    },
    {
      "level": -5,
      "rarity": "unique",
      "expected_effective_depth": 8,
      "expected_monster_loot_table": "dungeon_mob_drop_depth_3_plus"
    }
  ],
  "generated_cases": [
    {
      "name": "level_2_unique_then_common",
      "seed": "v30_monster_rarity",
      "level": -2,
      "expected_monsters": [
        {
          "index": 0,
          "rarity": "unique",
          "loot_table": "dungeon_mob_drop_depth_3_plus",
          "max_hp": 14,
          "attack_damage": {
            "min": 2,
            "max": 4
          },
          "armor": 5,
          "hit_chance": 0.64,
          "crit_chance": 0.085,
          "block_percent": 13,
          "attack_cooldown_ticks": 15,
          "xp_reward": 15
        },
        {
          "index": 1,
          "rarity": "common",
          "loot_table": "dungeon_mob_drop_depth_2",
          "max_hp": 5,
          "attack_damage": {
            "min": 1,
            "max": 2
          },
          "armor": 1,
          "hit_chance": 0.52,
          "crit_chance": 0.005,
          "block_percent": 1,
          "attack_cooldown_ticks": 20,
          "xp_reward": 5
        }
      ]
    }
  ]
}
